{
  "processor": "stripe",
  "processor_event_id": "evt_1PZQaBcDeFgHiJkLmNoPqR2",
  "kind": "subscription",
  "subscription_id": "sub_1PZQaBcDeFgHiJkLmNoPqR1",
  "customer_id": "cus_R1pQKz9xLp2mN4vB6yH8jL0",
  "status": "active",
  "quantity": 3,
  "price_id": "price_1PZQaBcDeFgHiJkLmNoPqR2",
  "unit_amount": {
    "amount_minor": 2900,
    "currency": "USD"
  },
  "current_period_start": "2026-09-30T04:00:00Z",
  "current_period_end": "2026-10-30T04:00:00Z",
  "cancel_at_period_end": true,
  "canceled_at": null,
  "trial": false
}